{
  "intentId": "int_a1b2c3d4e5f6a7b8c9d0e1f2a3b4c5d6",
  "ucaId": "uca_f6e5d4c3b2a1f6e5d4c3b2a1f6e5d4c3",
  "type": "transfer",
  "params": {
    "fromChainId": 1,
    "toChainId": 1,
    "fromAsset": "eth:0000000000000000000000000000000000000000",
    "amount": "1000000000000000000",
    "recipient": "0x742d35cc6634c0532925a3b844bc9e7595f2bd3e"
  },
  "status": "created",
  "nonce": "42",
  "createdAt": "2026-01-15T10:30:00Z"
}
